<?xml version="1.0" encoding="UTF-8"?>
<csdbRules xmlns="http://www.s1000d.org/csdb/rules"
           xmlns:xsi="http://www.w3.org/2001/XMLSchema-instance"
           xsi:noNamespaceSchemaLocation="../schemas/csdb_rules.xsd">
  <naming>
    <rule id="MIC">MIC MUST be BWQ1 (A–Z0–9)</rule>
    <rule id="DMC">Filename MUST equal dmCode; hyphens preserved as per DMC fields</rule>
    <rule id="CLASS">Classification string MUST be "INTERNAL–EVIDENCE-REQUIRED" (en dash)</rule>
  </naming>
  <referencing>
    <rule id="BREX">All DMs MUST include brexDmRef to DMC BWQ1-A-00-00-00-00A-022A-D</rule>
    <rule id="CIR">CIR references use refs/externalPubRef pubCode="CIR-BWQ1-xxxxx"</rule>
    <rule id="CROSS-ATA">Cross-ATA refs (e.g., ATA-27) MUST be via dmRef with correct DMC</rule>
  </referencing>
  <validation>
    <rule id="XSD">All XML MUST validate against Issue 6 XSD (no DTD)</rule>
    <rule id="IC">IC family MUST match bucket (desc/proc/fault/ipd)</rule>
    <rule id="DMRL">Every DMRL entry MUST have a corresponding DM file</rule>
    <rule id="UNIQUENESS">DMC MUST be unique within CSDB</rule>
  </validation>
  <process>
    <rule id="REVIEW">Author → Reviewer → Integrator → QA</rule>
    <rule id="ISSUE">issueNumber increments on major changes; inWork "00" only for released</rule>
  </process>
</csdbRules>